{
  "core_lock_root": "8fd7f41b8cdd7f19392c8c4a7cf7ba352581b9a017363c9506f27bdd992a155f",
  "kind": "GENESIS_V1_CORE_LOCK",
  "language_version": "1.0.0",
  "sections": [
    {
      "core_bytes": 1652269,
      "core_crc": "PASS",
      "core_file": "GENESIS_CHIRALITY_MACHINE_SECTION_01_HARDWARE_ABI_v0.1.0_20260821_PART_A_CORE.zip",
      "core_sha256": "5e25b86052d93c2e3d7bef3c46e2d2f183daffa293d21d351c291581497b0b80",
      "manifest_file": "GENESIS_CHIRALITY_MACHINE_SECTION_01_HARDWARE_ABI_v0.1.0_20260821_MANIFEST.json",
      "manifest_sha256": "b48e9608477edcb38b5b8e60f35a241f3941f056e667dbd02774bceee2cee6f7",
      "package_status_file": "GENESIS_CHIRALITY_MACHINE_SECTION_01_HARDWARE_ABI_v0.1.0_20260821_PACKAGE_STATUS.txt",
      "package_status_sha256": "9b9e35f1b4caca803c3cd81e5a820f74947d48130168958c3aca61242b2e2a08",
      "prior_validation": {},
      "prior_version": "0.1.0",
      "section": 1,
      "sha256_ledger_file": "GENESIS_CHIRALITY_MACHINE_SECTION_01_HARDWARE_ABI_v0.1.0_20260821_SHA256.txt",
      "sha256_ledger_sha256": "5981bfafebebaf529c65bb11a36d6c27908d2cd076a2198ea3b5ab85db4fb9c0",
      "title": "Hardware ABI"
    },
    {
      "core_bytes": 131989,
      "core_crc": "PASS",
      "core_file": "GENESIS_CHIRALITY_MACHINE_SECTION_02_GEOMETRIC_INSTANTIATION_v0.1.0_20260821_PART_A_CORE.zip",
      "core_sha256": "bbf6d27eab4b6dcc8d8f4d2c107e501ee4a0d1c56b23cd0bd958ac8676a899a6",
      "manifest_file": "GENESIS_CHIRALITY_MACHINE_SECTION_02_GEOMETRIC_INSTANTIATION_v0.1.0_20260821_MANIFEST.json",
      "manifest_sha256": "bf39a4c361da1fd0944e0d14d1c562176f6b8a71efc674d4b1bd649082b8f67b",
      "package_status_file": "GENESIS_CHIRALITY_MACHINE_SECTION_02_GEOMETRIC_INSTANTIATION_v0.1.0_20260821_PACKAGE_STATUS.txt",
      "package_status_sha256": "4387b85ff0a1a2dd988f94b674c6ead871caa0ae7fecb7c3d9abe6bc6646127c",
      "prior_validation": {},
      "prior_version": "0.1.0",
      "section": 2,
      "sha256_ledger_file": "GENESIS_CHIRALITY_MACHINE_SECTION_02_GEOMETRIC_INSTANTIATION_v0.1.0_20260821_SHA256.txt",
      "sha256_ledger_sha256": "ba479695423528587a969f4992e7eb94d548170564d674e352ede4dc3fbfa512",
      "title": "Geometric Instantiation Engine / MMO Memory Model"
    },
    {
      "core_bytes": 1217962,
      "core_crc": "PASS",
      "core_file": "GENESIS_CHIRALITY_MACHINE_SECTION_03_TRANSFORMATION_ENGINE_v0.1.0_20260821_PART_A_CORE.zip",
      "core_sha256": "01d9d7b12ddd6264a76818d685e0bff7858b28dcb24f24228c8ed95d1328848f",
      "manifest_file": "GENESIS_CHIRALITY_MACHINE_SECTION_03_TRANSFORMATION_ENGINE_v0.1.0_20260821_MANIFEST.json",
      "manifest_sha256": "99fedfbb4527c4bb3ff416ca8ea78de1c98c371e1f6c02b98befd1e5a59ffa09",
      "package_status_file": "GENESIS_CHIRALITY_MACHINE_SECTION_03_TRANSFORMATION_ENGINE_v0.1.0_20260821_PACKAGE_STATUS.txt",
      "package_status_sha256": "a57b7c3b12b4dccc9e571dadc1158fda7de1c228ad0be924f03415c900f7d016",
      "prior_validation": {},
      "prior_version": "0.1.0",
      "section": 3,
      "sha256_ledger_file": "GENESIS_CHIRALITY_MACHINE_SECTION_03_TRANSFORMATION_ENGINE_v0.1.0_20260821_SHA256.txt",
      "sha256_ledger_sha256": "d8abfb88faec8db9a2bf30eb248599ab60f619d0fb87f144e1cc0577724fc9dd",
      "title": "Transformation Engine + Geometric Forking"
    },
    {
      "core_bytes": 201864,
      "core_crc": "PASS",
      "core_file": "GENESIS_CHIRALITY_MACHINE_SECTION_04_PORTAL_ENGINE_v0.1.0_20260821_PART_A_CORE.zip",
      "core_sha256": "993a952340ac433a273f5a7025e37b765420efca6135688ef5cc006c20a0a98c",
      "manifest_file": "GENESIS_CHIRALITY_MACHINE_SECTION_04_PORTAL_ENGINE_v0.1.0_20260821_MANIFEST.json",
      "manifest_sha256": "e4f5033b4ddabe4beb67340a2e4b8645c5fcec5f17a4c51ae438d20d98dbd70d",
      "package_status_file": "GENESIS_CHIRALITY_MACHINE_SECTION_04_PORTAL_ENGINE_v0.1.0_20260821_PACKAGE_STATUS.txt",
      "package_status_sha256": "dcfd0daccf8df5df2422236a5d3f93d90c5b63be45345d9cea2acc48d20c0b97",
      "prior_validation": {},
      "prior_version": "0.1.0",
      "section": 4,
      "sha256_ledger_file": "GENESIS_CHIRALITY_MACHINE_SECTION_04_PORTAL_ENGINE_v0.1.0_20260821_SHA256.txt",
      "sha256_ledger_sha256": "17702625f7973355c6d8f8eecc70dd08a16f5f2a9e5ba261d4d77edec19afd99",
      "title": "Portal Transaction Engine + Corridor Admission"
    },
    {
      "core_bytes": 246759,
      "core_crc": "PASS",
      "core_file": "GENESIS_CHIRALITY_MACHINE_SECTION_05_RAINBOW_ROAD_v0.1.0_20260821_PART_A_CORE.zip",
      "core_sha256": "43ce23329492e44a0501be0eacfd589f9968e158b0a914fb2ab6cf0e1eb31c99",
      "manifest_file": "GENESIS_CHIRALITY_MACHINE_SECTION_05_RAINBOW_ROAD_v0.1.0_20260821_MANIFEST.json",
      "manifest_sha256": "71dc52cbf82d52373978b1dcb28d647d5ed8bb214cb3ce0a9cc6ab0c7d6c6345",
      "package_status_file": "GENESIS_CHIRALITY_MACHINE_SECTION_05_RAINBOW_ROAD_v0.1.0_20260821_PACKAGE_STATUS.txt",
      "package_status_sha256": "1fe701de5673873885a11c0b130186e970f434a1ea6f6b7555bb7d8a948402e6",
      "prior_validation": {},
      "prior_version": "0.1.0",
      "section": 5,
      "sha256_ledger_file": "GENESIS_CHIRALITY_MACHINE_SECTION_05_RAINBOW_ROAD_v0.1.0_20260821_SHA256.txt",
      "sha256_ledger_sha256": "304b9a61585628fb0773868c5be836878e701e84827cd3b00392942253470dcc",
      "title": "Rainbow Road Composition Engine"
    },
    {
      "core_bytes": 324064,
      "core_crc": "PASS",
      "core_file": "GENESIS_CHIRALITY_MACHINE_SECTION_06_QFT_GR_TRANSDUCTION_v0.1.0_20260821_PART_A_CORE.zip",
      "core_sha256": "3cba0d65eb9453a045d5e2133ffe61cd45242fae66f6ba7570232b1add9a5b80",
      "manifest_file": "GENESIS_CHIRALITY_MACHINE_SECTION_06_QFT_GR_TRANSDUCTION_v0.1.0_20260821_MANIFEST.json",
      "manifest_sha256": "95e16b1fca3b2a030a03106d189b9c8e71042b1c980b2f6f5de43fb9b5d6b658",
      "package_status_file": "GENESIS_CHIRALITY_MACHINE_SECTION_06_QFT_GR_TRANSDUCTION_v0.1.0_20260821_PACKAGE_STATUS.txt",
      "package_status_sha256": "6c4594d0da2c8ef48efc3395acbcf1e39b16b499ce2d92c378523fb73748cac3",
      "prior_validation": {},
      "prior_version": "0.1.0",
      "section": 6,
      "sha256_ledger_file": "GENESIS_CHIRALITY_MACHINE_SECTION_06_QFT_GR_TRANSDUCTION_v0.1.0_20260821_SHA256.txt",
      "sha256_ledger_sha256": "c0b4fbb8fb2c0b7578ed773897e798dc0b8b8447ca885a8b20b37523ee67e274",
      "title": "QFT/GR Bridge + Sector Transduction Engine"
    },
    {
      "core_bytes": 384435,
      "core_crc": "PASS",
      "core_file": "GENESIS_CHIRALITY_MACHINE_SECTION_07_QUANTUM_INFORMATION_EFFECTS_v0.1.0_20260821_PART_A_CORE.zip",
      "core_sha256": "8e9112a445c0564dfa05fcff33792d3e0eef8cdf970e52346930d76a57dae7d3",
      "manifest_file": "GENESIS_CHIRALITY_MACHINE_SECTION_07_QUANTUM_INFORMATION_EFFECTS_v0.1.0_20260821_MANIFEST.json",
      "manifest_sha256": "af9c37f64b274f9344a2748f27ea14dbb06fba94b0c5179d7486b55c16feb0ab",
      "package_status_file": "GENESIS_CHIRALITY_MACHINE_SECTION_07_QUANTUM_INFORMATION_EFFECTS_v0.1.0_20260821_PACKAGE_STATUS.txt",
      "package_status_sha256": "8ef62212664c9dd1039ce737dd0aad76a3d1abcf09a59f4f444834283576dcee",
      "prior_validation": {},
      "prior_version": "0.1.0",
      "section": 7,
      "sha256_ledger_file": "GENESIS_CHIRALITY_MACHINE_SECTION_07_QUANTUM_INFORMATION_EFFECTS_v0.1.0_20260821_SHA256.txt",
      "sha256_ledger_sha256": "f5b0c1a1c3c106496dfb595d1ef80d4ed16033064c02478371f4ef343157c74a",
      "title": "Quantum Information State + Effect System"
    },
    {
      "core_bytes": 144900,
      "core_crc": "PASS",
      "core_file": "GENESIS_CHIRALITY_MACHINE_SECTION_08_VM_IR_v0.1.0_20260821_PART_A_CORE.zip",
      "core_sha256": "707c302ba9d09e78f423795fcabb933968d007e5abd58501a0dced2492d7b6b7",
      "manifest_file": "GENESIS_CHIRALITY_MACHINE_SECTION_08_VM_IR_v0.1.0_20260821_MANIFEST.json",
      "manifest_sha256": "ec64849c6e0dd92af12ac2f09dea0422e7b37af44bcbec873c4cd4a7dcb33bb7",
      "package_status_file": "GENESIS_CHIRALITY_MACHINE_SECTION_08_VM_IR_v0.1.0_20260821_PACKAGE_STATUS.txt",
      "package_status_sha256": "b743f91442cd201928ff3f3579e154a6147f16594749e806f3bb06c759a0af93",
      "prior_validation": {},
      "prior_version": "0.1.0",
      "section": 8,
      "sha256_ledger_file": "GENESIS_CHIRALITY_MACHINE_SECTION_08_VM_IR_v0.1.0_20260821_SHA256.txt",
      "sha256_ledger_sha256": "f57a6d672ebee9a088a6f7922eff5a63820b1d296bb6d6b12e2c16827e37b940",
      "title": "Genesis VM / Intermediate Representation"
    },
    {
      "core_bytes": 198359,
      "core_crc": "PASS",
      "core_file": "GENESIS_CHIRALITY_MACHINE_SECTION_09_STATIC_SEMANTICS_LINKER_v0.1.0_20260821_PART_A_CORE.zip",
      "core_sha256": "8d2b040af79b7db83046560a6f265b5fd9bf9ccb7f89956e557be1ff417e9e5a",
      "manifest_file": "GENESIS_CHIRALITY_MACHINE_SECTION_09_STATIC_SEMANTICS_LINKER_v0.1.0_20260821_MANIFEST.json",
      "manifest_sha256": "6815c4a957adea56249b97c56e06588a28c33e72ca12127eaa77d96c873f42fb",
      "package_status_file": "GENESIS_CHIRALITY_MACHINE_SECTION_09_STATIC_SEMANTICS_LINKER_v0.1.0_20260821_PACKAGE_STATUS.txt",
      "package_status_sha256": "8b4c54a27d9a1869098645493d8411a269a68052c34cbc0e4d3940f34597951c",
      "prior_validation": {},
      "prior_version": "0.1.0",
      "section": 9,
      "sha256_ledger_file": "GENESIS_CHIRALITY_MACHINE_SECTION_09_STATIC_SEMANTICS_LINKER_v0.1.0_20260821_SHA256.txt",
      "sha256_ledger_sha256": "103f576fe7ffeaf089a67639f3497a49648e7032fde8e00286d15fd5f654222c",
      "title": "Static Type/Effect Checker + Semantic Linker"
    },
    {
      "core_bytes": 145867,
      "core_crc": "PASS",
      "core_file": "GENESIS_CHIRALITY_MACHINE_SECTION_10_GENESIS_FRONTEND_v0.1.0_20260821_PART_A_CORE.zip",
      "core_sha256": "c6cc776b3f735896ca4dbe16b6a57df0ebe5071a6493199ea03639815322436d",
      "manifest_file": "GENESIS_CHIRALITY_MACHINE_SECTION_10_GENESIS_FRONTEND_v0.1.0_20260821_MANIFEST.json",
      "manifest_sha256": "31af9ff45460d7c33102f90d67fbf929da3d84a534ae52392c16cfe6aff7c28d",